<?xml version="1.0" encoding="UTF-8"?>
<dataroot xmlns:od="urn:schemas-microsoft-com:officedata" xmlns:xsi="http://www.w3.org/2001/XMLSchema-instance" xsi:noNamespaceSchemaLocation="cicles.xsd" generated="2020-02-17T14:37:18">
<CICLE>
<CICLEID>57141</CICLEID>
<CICLENOM>CINC</CICLENOM>
<CICLEINFO>El CINC és una iniciativa de la Direcció General de Política Lingüística del Departament de Cultura per fer créixer l’oferta i el consum de cinema infantil en català, amb la col·laboració del Consorci per a la Normalització Lingüística i de diversos ajuntaments, institucions, entitats i cinemes.</CICLEINFO>
<IMGCICLE>cinqueta.jpg</IMGCICLE>
</CICLE>
<CICLE>
<CICLEID>57142</CICLEID>
<CICLENOM>DocsBarcelona del Mes</CICLENOM>
<CICLEINFO>El Documental del Mes és una iniciativa de la productora Parallel 40 per incrementar la presència del documental europeu a les pantalles cinematogràfiques.</CICLEINFO>
<IMGCICLE>docsbarcelonadelmes_cicle.jpg</IMGCICLE>
</CICLE>
<CICLE>
<CICLEID>57253</CICLEID>
<CICLENOM>Cicle de cinema en valencià</CICLENOM>
<CICLEINFO>La Universitat Miguel Hernández d’Elx organitza novament un nou cicle de cinema en valencià a la sala Òdeon amb la col·laboració d’El Tempir, l’Institut d’Estudis Comarcals del Baix Vinalopó, ACPV-Casal Elx, el Cineclub Luis Buñuel, les universitats públiques valencianes i el cinema Òdeon d’Elx.</CICLEINFO>
<IMGCICLE>cicledecinemaenvalencia2020_cicle.jpg</IMGCICLE>
</CICLE>
<CICLE>
<CICLEID>57261</CICLEID>
<CICLENOM>FilmoXarxa</CICLENOM>
<CICLEINFO>FilmoXarxa és una iniciativa per ajudar a distribuir per tota la geografia catalana films subtitulats en català que fins ara no han trobat acollida dins dels circuits comercials habituals. Aquest cicle té el suport de la Direcció General de Política Lingüística del Departament de Cultura.</CICLEINFO>
<IMGCICLE>filmoxarxa_cicle.jpg</IMGCICLE>
</CICLE>
<CICLE>
<CICLEID>57222</CICLEID>
<CICLENOM>Le Petit Truffaut</CICLENOM>
<CICLEINFO>Espai de cinema infantil, dedicat als més petits de la casa, que pretén vetllar per a garantir que el cinema infantil per als més exigents tingui el seu espai a la ciutat de Girona. Un espai on els nens i nenes vegin i sentin el cinema d’una manera diferent, ampliant les reduïdes opcions que es troben als cinemes convencionals.</CICLEINFO>
<IMGCICLE>lepetittruffaut2020_cicle.jpg</IMGCICLE>
</CICLE>
<CICLE>
<CICLEID>57257</CICLEID>
<CICLENOM>Òmnium Catalunya Nord</CICLENOM>
<CICLEINFO>Cinema en català als pobles de Catalunya Nord, organitzat per Òmnium Catalunya Nord.</CICLEINFO>
<IMGCICLE>omniumcatalunyanord_cicle.jpg</IMGCICLE>
</CICLE>
<CICLE>
<CICLEID>57262</CICLEID>
<CICLENOM>Premis VOC - Mostra d’Audiovisual en Català</CICLENOM>
<CICLEINFO>4a edició dels Premis VOC -Versió Original en Català-, premis i mostra especialitzada en curtmetratges de ficció i documentals en llengua catalana que organitza Òmnium Cultural, amb la finalitat d’estimular la producció de continguts audiovisuals de qualitat en llengua catalana, contribuir a la seva difusió i ampliar-ne el públic. La mostra es podrà veure a més de 30 seus dels Països Catalans i d’Europa.</CICLEINFO>
<IMGCICLE>vocpremismostraaudiovisualencatala.jpg</IMGCICLE>
<WEB>https://www.omnium.cat/ca/projectes/voc/</WEB>
</CICLE>
<CICLE>
<CICLEID>57221</CICLEID>
<CICLENOM>Un Dia de Festa</CICLENOM>
<CICLEINFO>4a edició d'Un Dia de Festa, la Festa del Cinema Infantil en Català, un matí o tarda de cinema familiar, música, teatre i festa. Una proposta cultural a partir de 3 anys que presenta una nova manera d’anar al cinema amb els infants.</CICLEINFO>
<IMGCICLE>undiadefesta2020_cicle.jpg</IMGCICLE>
</CICLE>
</dataroot>